{
  "schema_version": "0.1.0",
  "titulo": "Ciclo XII — Ecologia Monstruosa de Eldroth, Vandar e Ironwood",
  "estado": "propostas_narrativas_nao_canonicas",
  "aprovacao_autoral": false,
  "efeito_automatico_no_canon": false,
  "fonte_primaria": "data/propostas/ironwood-eldroth-resistencia-hack.json",
  "fontes_referencia": [
    "data/taxonomia_carcaca.json",
    "docs/ONTOLOGIA_E_DUNGEON_WORLD.md",
    "data/propostas/ironwood-eldroth-resistencia-hack.json",
    "docs/ECOLOGIA_ARQUIVO_DOS_MORTOS_AFOGADOS.md",
    "Ambientação - A Carcaça - Visão Geral.txt"
  ],
  "principios": [
    "Sylara governa Eldroth e Damaris mantém os mortos-vivos em Vandar; as novas criaturas, suas espécies e aparições não são fatos da lore.",
    "Ironwood é fortaleza distinta de Eldroth; não transformar microespaços propostos em pontos cartográficos canônicos.",
    "Nenhuma criatura é inimiga, espiã ou serva da Corte por sua aparência, habitat ou natureza feérica.",
    "Os tipos são taxonomia hipotética da Carcaça; não reutilizar fichas D&D importadas nem converter ND em estatísticas DW.",
    "Conexões entre fauna, flora, sobreviventes e agentes da ocupação são conflitos de cenário, não medições naturais.",
    "As frentes usam presságios, não acontecimentos anteriores; apenas uma campanha poderá registrar realizações."
  ],
  "contagens": {
    "criaturas": 8,
    "encontros": 6,
    "pressoes": 4,
    "frentes": 2
  },
  "criaturas": [
    {
      "id": "ecologia-xii:criatura:coruja-do-eco-emprestado",
      "nome": "Coruja do Eco Emprestado",
      "categoria": "especie_ou_manifestacao_proposta",
      "estado": "proposta_nao_canonica",
      "tipo_carcaca_proposto": "fera_sobrenatural",
      "classe_de_registro": "rascunho_ecologico",
      "aprovacao_autoral": false,
      "ocorrencia_confirmada": false,
      "localizacao_proposta": {
        "escopo": "eldroth",
        "local_proposto_id": "ironwood-eldroth:lugar:clareira-das-testemunhas",
        "regiao_canonica_de_referencia": "regiao:eldroth",
        "habitat_possivel": "Copas densas e clareiras úmidas imaginadas no interior de Eldroth."
      },
      "ecologia": {
        "sinais": [
          "Um canto de ave retorna com a voz de alguém ausente",
          "Penas sem sombra repousam sobre casca úmida"
        ],
        "funcao_hipotetica": "Predadora ou imitadora acústica possível; a dieta não é comprovada.",
        "alimentacao_confirmada": null,
        "reproducao_confirmada": null,
        "densidade_confirmada": null,
        "relacao_com_ocupacao": "Relação com a vigilância de Sylara não comprovada: o uso político é uma hipótese de aventura.",
        "hipoteses_abertas": [
          "Imita vozes por magia própria ou por efeito do ambiente?",
          "É explorada por patrulhas ou apenas tolerada?"
        ]
      },
      "dungeon_world": {
        "estado": "instinto_e_movimentos_propostos",
        "instinto": "Conservar para si o último som ouvido e devolvê-lo quando ninguém pode confiar nele.",
        "organizacao_tag_proposta": "solitario",
        "movimentos": [
          {
            "nome": "Eco que Acusa",
            "texto": "Repetir uma confissão no momento em que ela mais compromete um inocente.",
            "origem": "criacao_autoral_ciclo_xii"
          },
          {
            "nome": "Silêncio de Ninho",
            "texto": "Subtrair os sons de aviso de uma pequena passagem.",
            "origem": "criacao_autoral_ciclo_xii"
          },
          {
            "nome": "Voo sem Testemunha",
            "texto": "Sair do alcance visual quando uma vítima tenta provar que a viu.",
            "origem": "criacao_autoral_ciclo_xii"
          }
        ],
        "estatisticas": {
          "estado": "pendente_do_procedimento_dw",
          "pv": null,
          "armadura": null,
          "dano": null,
          "nd_dnd": null
        }
      },
      "solucoes_nao_violentas": [
        "Conferir o som com outras testemunhas",
        "Afastar-se sem perseguir a ave",
        "Criar um sinal não vocal"
      ],
      "ancora_ficcional": {
        "referencia": "ironwood-eldroth:lugar:clareira-das-testemunhas",
        "origem": "povoamento_xi_proposto",
        "nota": "Relação temática sugerida: não confirma que o ser habita o lugar."
      },
      "vinculo_cena_anterior": "ironwood-eldroth:cena:passaro-sem-canto"
    },
    {
      "id": "ecologia-xii:criatura:besouros-da-casca-riscada",
      "nome": "Besouros da Casca Riscada",
      "categoria": "especie_ou_manifestacao_proposta",
      "estado": "proposta_nao_canonica",
      "tipo_carcaca_proposto": "fauna",
      "classe_de_registro": "rascunho_ecologico",
      "aprovacao_autoral": false,
      "ocorrencia_confirmada": false,
      "localizacao_proposta": {
        "escopo": "ironwood",
        "local_proposto_id": "ironwood-eldroth:lugar:patio-da-trilha-incompleta",
        "regiao_canonica_de_referencia": null,
        "habitat_possivel": "Madeira caída, cascas velhas e depósitos vegetais ao redor de uma fortaleza florestal proposta."
      },
      "ecologia": {
        "sinais": [
          "Ranhuras paralelas em galhos já mortos",
          "Pequenos rastros de serragem junto à casca"
        ],
        "funcao_hipotetica": "Decompositores possíveis; tornam rastros legíveis a observadores, sem intenção política.",
        "alimentacao_confirmada": null,
        "reproducao_confirmada": null,
        "densidade_confirmada": null,
        "relacao_com_ocupacao": "Nenhuma filiação à Corte; não presumir que o comportamento animal seja espionagem.",
        "hipoteses_abertas": [
          "Alimentam-se apenas de madeira morta?",
          "Apresentam comportamento sazonal?"
        ]
      },
      "dungeon_world": {
        "estado": "instinto_e_movimentos_propostos",
        "instinto": "Decompor a madeira morta e proteger a própria postura de vibrações excessivas.",
        "organizacao_tag_proposta": "horda",
        "movimentos": [
          {
            "nome": "Cortina de Serragem",
            "texto": "Encobrir uma marca no chão quando a madeira é sacudida.",
            "origem": "criacao_autoral_ciclo_xii"
          },
          {
            "nome": "Casca em Movimento",
            "texto": "Fazer uma trilha parecer recém-usada por um animal maior.",
            "origem": "criacao_autoral_ciclo_xii"
          },
          {
            "nome": "Defesa do Ninho",
            "texto": "Enxamear os pés de quem destrói a madeira habitada.",
            "origem": "criacao_autoral_ciclo_xii"
          }
        ],
        "estatisticas": {
          "estado": "pendente_do_procedimento_dw",
          "pv": null,
          "armadura": null,
          "dano": null,
          "nd_dnd": null
        }
      },
      "solucoes_nao_violentas": [
        "Evitar troncos com postura",
        "Usar outro suporte estrutural",
        "Observar os rastros antes de concluir perseguição"
      ],
      "ancora_ficcional": {
        "referencia": "ironwood-eldroth:lugar:patio-da-trilha-incompleta",
        "origem": "povoamento_xi_proposto",
        "nota": "Relação temática sugerida: não confirma que o ser habita o lugar."
      },
      "vinculo_cena_anterior": "ironwood-eldroth:cena:aprendiz-do-mapa"
    },
    {
      "id": "ecologia-xii:criatura:cardos-que-bebem-cinza",
      "nome": "Cardos que Bebem Cinza",
      "categoria": "especie_ou_manifestacao_proposta",
      "estado": "proposta_nao_canonica",
      "tipo_carcaca_proposto": "flora",
      "classe_de_registro": "rascunho_ecologico",
      "aprovacao_autoral": false,
      "ocorrencia_confirmada": false,
      "localizacao_proposta": {
        "escopo": "eldroth",
        "local_proposto_id": "ironwood-eldroth:lugar:canteiro-da-lua-ferida",
        "regiao_canonica_de_referencia": "regiao:eldroth",
        "habitat_possivel": "Solo queimado e pequenas clareiras em áreas com vegetação danificada."
      },
      "ecologia": {
        "sinais": [
          "Folhas finas com poeira cinza nas nervuras",
          "Espinhos retêm fuligem mesmo depois de chuva"
        ],
        "funcao_hipotetica": "Planta oportunista proposta; pode indicar solo perturbado, sem comprovar corrupção sobrenatural.",
        "alimentacao_confirmada": null,
        "reproducao_confirmada": null,
        "densidade_confirmada": null,
        "relacao_com_ocupacao": "A vegetação pode ser afetada pela ocupação, mas não está a serviço de Sylara por definição.",
        "hipoteses_abertas": [
          "Suas sementes são tóxicas?",
          "Podem participar de remédios locais?"
        ]
      },
      "dungeon_world": {
        "estado": "instinto_e_movimentos_propostos",
        "instinto": "Armazenar nutrientes da terra ferida e espalhar sementes após perturbações.",
        "organizacao_tag_proposta": "grupo",
        "movimentos": [
          {
            "nome": "Poeira que Revela",
            "texto": "Marcar de fuligem mãos que mexeram na planta.",
            "origem": "criacao_autoral_ciclo_xii"
          },
          {
            "nome": "Espinhos na Passagem",
            "texto": "Fechar uma passagem estreita ao rebrotar sobre madeira podre.",
            "origem": "criacao_autoral_ciclo_xii"
          },
          {
            "nome": "Semente Retida",
            "texto": "Espalhar sementes quando uma fogueira é apagada no solo.",
            "origem": "criacao_autoral_ciclo_xii"
          }
        ],
        "estatisticas": {
          "estado": "pendente_do_procedimento_dw",
          "pv": null,
          "armadura": null,
          "dano": null,
          "nd_dnd": null
        }
      },
      "solucoes_nao_violentas": [
        "Isolar uma amostra",
        "Observar solo e água",
        "Evitar queimada sem diagnóstico"
      ],
      "ancora_ficcional": {
        "referencia": "ironwood-eldroth:lugar:canteiro-da-lua-ferida",
        "origem": "povoamento_xi_proposto",